{
  "schema_version": 1,
  "status": "approved",
  "skill": "culture",
  "invocation": "/culture",
  "kinds": {
    "journey": {
      "grader": "journey",
      "gate": "evals/gates/journey.py",
      "rubric": "Pass only when the transcript shows every item in reference.must and the agent wrote culture.md without writing source code."
    }
  },
  "editable": []
}
