{
  "schema_version": 1,
  "status": "approved",
  "skill": "skillz",
  "invocation": "$skillz",
  "kinds": {
    "task": {
      "grader": "judge",
      "rubric": "Score the response to the task request against `reference`, which holds `expected_output` and a list of `assertions`. Treat `expected_output` and each assertion as one criterion. Give each criterion 100 when the response meets it and 0 when it does not or contradicts it. Score the response as the mean of the criteria, rounded to a whole number. Give 0 when the response is missing, ignores the task request, or acts on a different skill than the request names."
    },
    "inspection": {
      "grader": "exact-json"
    }
  },
  "helper": {
    "path": "scripts/inspect-skill.pyz",
    "input": "evals/files/fixture.md",
    "fixtures": [
      {
        "input": "---\nname: contract\ndescription: Inspect\n---\n# Body\n[Guide](references/guide.md)\n",
        "returncode": 0,
        "output": {
          "schema_version": 4,
          "advisory_sentences": [],
          "frontmatter_keys": [
            "description",
            "name"
          ],
          "body_line_count": 2,
          "local_link_targets": [
            "references/guide.md"
          ],
          "long_sentences": []
        }
      },
      {
        "input": "---\nname: contract\n---\n[Escape](../secret)\n",
        "returncode": 3,
        "output": null,
        "error": {
          "error": "inspect: link escapes package",
          "exit_code": 3
        }
      }
    ]
  },
  "editable": [
    "SKILL.md",
    "references/anti-patterns.md",
    "references/description-optimization.md",
    "references/offload.md",
    "references/progressive-disclosure.md"
  ]
}
